{
  "schema_version": 1,
  "asset_id": "glyph_flow",
  "role": "Direct-written magical glyph for FLOW in the Slice Magic Glyph Runtime Set.",
  "decision_ids": ["GM-SPELL-WORKFLOW-UI-V2-01", "GM-GLYPH-VOCABULARY-V1-01", "ART-STYLE-01", "GM-VISUAL-DIRECTION-20260825-01"],
  "source": {
    "storage": "GENERATED_CANDIDATE",
    "file_id_or_path": "C:/Users/user/.codex/generated_images/01a03ddc-b904-72d1-826e-749d698c97a5/exec-31946009-0a44-48e5-afa2-c75d3641ee37.png",
    "sha256": "80c1559fce7cb49c30ef93728e576313ae59eafa9bacda6f88d07ec5711dd42b",
    "tool": "OpenAI Image Generation built-in",
    "owner": "User-approved GPT Work visual production",
    "prompt_or_brief_path": "docs/planning/GRIMOIRE_GPT_WORK_IMAGE_GOAL_HANDOFF_2026-08-26.md"
  },
  "export": {"file_path": "assets/art/ui/glyphs/glyph_flow.png", "sha256": "0fc6ece56f6a43048a100f9a35454a766ff48a58bc53c99cb9e121f079aef85a", "format": "PNG", "width": 512, "height": 512, "alpha": true, "import_profile": "Godot Texture2D PNG; import not yet verified"},
  "license": {"status": "PROJECT_ORIGINAL", "evidence": "User approved this generated image for GRIMOIRE on 2026-08-26.", "credit_required": false, "modification_allowed": true, "redistribution_allowed": false},
  "status": "PROJECT_ASSET_APPROVED",
  "approved_by": "User",
  "approved_at": "2026-08-26",
  "used_in_screens": ["src/ui/spell_workflow/glyph_drawing_screen.tscn", "src/ui/spell_workflow/components/glyph_card.tscn", "src/ui/spell_workflow/circuit_placement_screen.tscn", "src/ui/components/star_circuit_board.tscn", "future Task8 Spell Use thin UI"],
  "replacement_or_supersession": "Temporary approved visual canon; re-evaluate at 48/64/96px runtime legibility review.",
  "runtime_validation": "NOT_RUN"
}
